{
  "project": "early_clock",
  "date": "",
  "steps": {
    "pre_gates": "pass",
    "toolchain": "ok",
    "compile": "1 objeto(s)",
    "rom": "/mnt/sdcard/Projects/SMSForge/SMS_projects/_laboratorio/early_clock/out/rom/early_clock.sms (16384 bytes)"
  },
  "axes": {
    "build": true,
    "validation_report": true,
    "boot_emulador": false,
    "gameplay": false,
    "fps_constante": false,
    "audio": false,
    "memory_bank_atualizado": false
  },
  "changelog": "/mnt/sdcard/Projects/SMSForge/SMS_projects/_laboratorio/early_clock/changelog/roms/build_v002/rom.sms"
}